{
  "summary": "Shady handles Watanya's paperwork and document custody.",
  "insights": [
    {
      "text": "Prefers weekly invoicing",
      "citations": [
        {
          "note_id": "01J8ZK9A000000000000000001",
          "block_id": "a1b2"
        }
      ]
    }
  ],
  "open_items": [
    {
      "text": "Promised to send the signed contract copy",
      "citations": [
        {
          "note_id": "01J8ZK9A000000000000000001",
          "block_id": "a1b3"
        }
      ]
    }
  ],
  "timeline": [
    {
      "date": "2026-09-28",
      "text": "Returned Watanya's contract to the safe",
      "citations": [
        {
          "note_id": "01J8ZK3M4X7Q0000000000NOTE",
          "block_id": "c1d2"
        }
      ]
    }
  ]
}
